reference,value_date,dr_cr,amount,description,currency,account
REF-2024-001,2024-01-15,C,15000.00,Payment from Goldman Sachs trade settlement TRD-001,USD,USD-NOSTRO-001
REF-2024-002,2024-01-15,D,8500.00,Wire transfer to JP Morgan FX settlement,USD,USD-NOSTRO-001
REF-2024-003,2024-01-16,C,22000.00,Morgan Stanley settlement batch 20240116,USD,USD-NOSTRO-001
REF-2024-004,2024-01-16,D,11500.00,Correspondent banking fee Citi Bank Jan 2024,USD,USD-NOSTRO-001
REF-2024-005,2024-01-17,C,35000.00,BNY Mellon trade settlement 20240117,USD,USD-NOSTRO-001
REF-2024-006,2024-01-17,D,5200.00,FX conversion EUR/USD spot settlement,USD,USD-NOSTRO-001
